user_id,playlist,name,album_name,album_date,album_date_precision,danceability,energy,speechiness,acousticness,instrumentalness,liveness,valence,track
12158075911,Luanas' Bday,Jackie Tequila,Calango,15/10/94,DAY,0.823,0.476,0.213,0.0210,0.0000,0.06,0.956,1
12158075911,Luanas' Bday,A Gente Bota Pra Quebrar - Ao Vivo Na Ilha Da Magia-Brasil/2008,Ao Vivo Na Ilha Da Magia,01/01/01/07/05,YEAR,0.664,0.766,0.0509,0.6270,0.0000,0.953,0.842,2
12158075911,Luanas' Bday,Agora Mexe (Eta Quebradeira) / Joga o Laço / Tira a Mão do Bolso (Ao Vivo),Pé no Chão   Harmonia do Samba Ao Vivo,04/03/02,DAY,0.392,0.954,0.084,0.6570,0.0000,0.956,0.807,3
12158075911,Luanas' Bday,Zoeira / Peneira / Te Desejo (Ao Vivo),Pé no Chão   Harmonia do Samba Ao Vivo,04/03/02,DAY,0.496,0.945,0.0565,0.7360,0.0000,0.873,0.955,4
12158075911,Luanas' Bday,Tchuí -Tchuí - Ao Vivo,Da Capelinha para o Mundo (Ao Vivo),01/12/04,DAY,0.581,0.906,0.0777,0.3180,0.0000,0.835,0.738,5
12158075911,Luanas' Bday,Mais Que Amigo / Nuance / Acordar Com Você - Ao Vivo,Pagode Do Exalta Ao Vivo,01/01/07,DAY,0.6,0.696,0.0472,0.6540,0.0000,0.856,0.749,6
12158075911,Luanas' Bday,Camarão Que Dorme a Onda Leva - Spc - Bagaço da Laranja,Mtv Ao Vivo Arlindo Cruz   Cd 1,18/04/09,DAY,0.541,0.856,0.0524,0.8820,0.0000,0.808,0.778,7
12158075911,Luanas' Bday,Pai - Live,Ao Vivo No Morro II,01/01/10,DAY,0.572,0.913,0.0554,0.4800,0.0000,0.699,0.833,8
12158075911,Luanas' Bday,Eu Te Devoro - Se,Ao Vivo No Olimpo   Músicas Extras do Dvd,04/10/10,DAY,0.387,0.239,0.0364,0.9310,0.0000,0.451,0.427,9
12158075911,Luanas' Bday,Insensato Destino,Ao Vivo No Olimpo   Músicas Extras do Dvd,04/10/10,DAY,0.544,0.564,0.0413,0.7990,0.0000,0.916,0.833,10
12158075911,Luanas' Bday,Vacilão-O Show Tem Que Continuar,Ao Vivo No Olimpo   Músicas Extras do Dvd,04/10/10,DAY,0.506,0.616,0.0417,0.7110,0.0000,0.734,0.921,11
12158075911,Luanas' Bday,Zé do Caroço-Na Palma da Mão-Rap do Simpático,Ao Vivo No Olimpo   Músicas Extras do Dvd,04/10/10,DAY,0.501,0.59,0.049,0.6440,0.0000,0.236,0.944,12
12158075911,Luanas' Bday,Sambas-de-Roda da Bahia-Olha o Samba Sinhá-Vai Lá- Vai Lá,Ao Vivo No Olimpo   Músicas Extras do Dvd,04/10/10,DAY,0.354,0.684,0.0822,0.7150,0.0001,0.955,0.873,13
12158075911,Luanas' Bday,Virou Religião-Poder de Sedução-Se Você Me Chamar Eu Vou,Ao Vivo No Olimpo   Músicas Extras do Dvd,04/10/10,DAY,0.451,0.717,0.0612,0.6860,0.0000,0.522,0.91,14
12158075911,Luanas' Bday,Cidade dos Poetas,Aplausos Para O Sol,20/09/11,DAY,0.399,0.421,0.037,0.7240,0.0000,0.103,0.784,15
12158075911,Luanas' Bday,Agora Viu Que Perdeu E Chora / Mulher Não Manda Em Homem - Live At HSBC Arena/Rio de Janeiro(RJ)-Brazil/2012,360º Ao Vivo,01/01/12,DAY,0.329,0.821,0.0934,0.7200,0.0000,0.739,0.671,16
12158075911,Luanas' Bday,Desafio / Zoeira / O Rodo / Peneira / Deslizando / Te Desejo (Minha Inha) / Destrambelhada / Rebolado / Quem Mandou / Tira A Mão Do Bolso - Ao Vivo Em Salvador,Harmonia Do Samba 20 Anos (Ao Vivo Em Salvador),01/01/13,DAY,0.635,0.915,0.0619,0.4650,0.0000,0.824,0.741,17
12158075911,Luanas' Bday,Rude,Don't Kill the Magic,25/06/14,DAY,0.774,0.756,0.0389,0.0423,0.0000,0.305,0.931,18
12158075911,Luanas' Bday,Abana,Abana,18/11/14,DAY,0.517,0.699,0.144,0.7570,0.0000,0.114,0.952,19
12158075911,Luanas' Bday,07/nov,BEYONCÉ [Platinum Edition],24/11/14,DAY,0.747,0.705,0.126,0.0128,0.0000,0.126,0.56,20
12158075911,Luanas' Bday,***Flawless (feat. Chimamanda Ngozi Adichie),BEYONCÉ [Platinum Edition],24/11/14,DAY,0.476,0.688,0.245,0.0953,0.0006,0.438,0.352,21
12158075911,Luanas' Bday,Anaconda,The Pinkprint (International Deluxe Explicit),15/12/14,DAY,0.964,0.605,0.179,0.0668,0.0000,0.214,0.646,22
12158075911,Luanas' Bday,Ai Ai Ai (Samba De Roda),Tà No DNA,01/01/15,DAY,0.594,0.732,0.0366,0.0158,0.0002,0.342,0.661,23
12158075911,Luanas' Bday,Daquele Jeito,Tà No DNA,01/01/15,DAY,0.777,0.585,0.0535,0.5330,0.0000,0.114,0.733,24
12158075911,Luanas' Bday,Uptown Funk (feat. Bruno Mars),Uptown Special,12/01/15,DAY,0.856,0.609,0.0824,0.0080,0.0001,0.0344,0.928,25
12158075911,Luanas' Bday,Ensaboado,Climatizar,09/02/15,DAY,0.674,0.828,0.0545,0.7870,0.0010,0.227,0.908,26
12158075911,Luanas' Bday,Bitch Better Have My Money,Bitch Better Have My Money,26/03/15,DAY,0.781,0.728,0.0621,0.0509,0.0000,0.257,0.395,27
12158075911,Luanas' Bday,Pegada do Negão,Pegada do Negão,07/05/15,DAY,0.757,0.658,0.102,0.4970,0.0000,0.136,0.92,28
12158075911,Luanas' Bday,Essa mina é louca (Participação especial de Jhama),Bang,13/10/15,DAY,0.645,0.806,0.0844,0.3860,0.0000,0.118,0.904,29
12158075911,Luanas' Bday,Não Me Deixe Sozinho,Nego Resolve,06/11/15,DAY,0.782,0.919,0.115,0.2740,0.0000,0.0521,0.691,30
12158075911,Luanas' Bday,Sorry,Purpose (Deluxe),13/11/15,DAY,0.654,0.76,0.045,0.0797,0.0000,0.299,0.41,31
12158075911,Luanas' Bday,Lean On (feat. MØ & DJ Snake),Peace Is The Mission : Extended,27/11/15,DAY,0.723,0.809,0.0625,0.0035,0.0012,0.565,0.274,32
12158075911,Luanas' Bday,Deboche,Deboche,27/11/15,DAY,0.752,0.604,0.0706,0.7830,0.0001,0.123,0.893,33
12158075911,Luanas' Bday,Vai Que Cola Melanina,Vai Que Cola,18/12/15,DAY,0.731,0.45,0.0744,0.4590,0.0000,0.144,0.766,34
12158075911,Luanas' Bday,Devagarinho,Devagarinho,18/12/15,DAY,0.863,0.592,0.0693,0.6040,0.0000,0.073,0.965,35
12158075911,Luanas' Bday,Tá Tranquilo- Tá Favorável,Tá Tranquilo  Tá Favorável,12/01/16,DAY,0.621,0.481,0.397,0.5840,0.0000,0.106,0.37,36
12158075911,Luanas' Bday,Work,ANTI (Deluxe),28/01/16,DAY,0.725,0.534,0.0946,0.0752,0.0000,0.0919,0.558,37
12158075911,Luanas' Bday,Sosseguei - Ao Vivo,Como. Sempre Feito. Nunca (ao Vivo),19/02/16,DAY,0.58,0.768,0.0382,0.4850,0.0000,0.452,0.675,38
12158075911,Luanas' Bday,O Nosso Santo Bateu - Na Praia / Ao Vivo,Na Praia (Ao Vivo),26/02/16,DAY,0.479,0.736,0.127,0.2200,0.0000,0.731,0.405,39
12158075911,Luanas' Bday,Infiel - Ao Vivo,Marília Mendonça   Ao Vivo,04/03/16,DAY,0.852,0.684,0.0377,0.6860,0.0000,0.145,0.616,40
12158075911,Luanas' Bday,Deixa em Off - Ao Vivo,Turma do Pagode XV Anos (Ao Vivo),18/03/16,DAY,0.599,0.812,0.0533,0.7320,0.0000,0.868,0.716,41
12158075911,Luanas' Bday,Hotline Bling,Views,06/05/16,DAY,0.891,0.628,0.0551,0.0026,0.0002,0.0504,0.552,42
12158075911,Luanas' Bday,One Dance,Views,06/05/16,DAY,0.792,0.625,0.0536,0.0078,0.0018,0.329,0.37,43
12158075911,Luanas' Bday,Vamo Que Vamo - Ao Vivo,#Vamoqvamo   Ao Vivo (Deluxe),13/05/16,DAY,0.716,0.899,0.124,0.3170,0.0000,0.371,0.712,44
12158075911,Luanas' Bday,Panda,New English,26/06/16,DAY,0.576,0.766,0.449,0.0280,0.0000,0.366,0.236,45
12158075911,Luanas' Bday,A Carta / Megastar / Telegrama (Acústico) - Ao Vivo,Exaltasamba no Estúdio Showlivre (Acústico) [Ao Vivo],13/07/16,DAY,0.44,0.751,0.0355,0.6580,0.0000,0.0985,0.788,46